Question,Answer
"What materials is the Armadix wardrobe made of?","The Armadix wardrobe features a modular design with customizable shelving and soft-close sliding doors, constructed from high-quality engineered wood."
"Is the Armadix wardrobe easy to assemble?","Yes, the Armadix wardrobe is designed for easy home assembly with clear instructions included."
"What are the dimensions of the Armadix wardrobe?","The dimensions of the Armadix wardrobe vary depending on the configuration. Please check our product page for exact measurements."
"Is the Armadix wardrobe available in different sizes?","Yes, the Armadix wardrobe is a modular system, allowing for various size configurations."
"Is the Armadix wardrobe available in different colors?","The Armadix wardrobe is available in the colors and finishes shown on our website."
"What is the weight capacity of the Armadix wardrobe shelves?","Each shelf can support up to [insert weight capacity here] pounds."
"Is the Armadix wardrobe suitable for a small bedroom?","Yes, the Armadix wardrobe's modular design allows for configurations suitable for various room sizes."
"How do I clean the Armadix wardrobe's surfaces?","Wipe the surfaces with a soft, damp cloth. Avoid harsh chemicals."
"Is the Armadix wardrobe covered by a warranty?","Yes, the Armadix wardrobe comes with a [insert warranty period] warranty."
"Can I see a 3D model of the Armadix wardrobe?","3D models and detailed images are available on our product page."
"How much does the Armadix wardrobe weigh?","The weight of the Armadix wardrobe varies depending on the configuration. Please check the product page."
"Is the Armadix wardrobe easy to move?","The Armadix wardrobe can be disassembled for easier moving."
"Can I purchase additional shelves for the Armadix wardrobe?","Yes, additional shelves and accessories can be purchased separately."
"Are the sliding doors of the Armadix wardrobe soft-close?","Yes, the Armadix wardrobe features soft-close sliding doors."
"Is the Armadix wardrobe's finish scratch-resistant?","The finish is durable but not scratch-proof. Avoid sharp objects."
"Does the Armadix wardrobe have any sharp edges?","The Armadix wardrobe is designed with smooth, rounded edges for safety."
"How many shelves are included in a standard Armadix wardrobe configuration?","The number of shelves varies. Please check the product specifications."
"Can I customize the interior layout of the Armadix wardrobe?","Yes, the Armadix wardrobe's modular design allows for customizable layouts."
"Is the Armadix wardrobe suitable for storing heavy items?","Yes, the Armadix wardrobe's shelves are designed to support a significant amount of weight."
"What is the height from the floor to the bottom of the Armadix wardrobe?","The height from the floor to the bottom of the wardrobe is [insert height here]."
"Is the Armadix wardrobe's interior lined?","The interior may or may not be lined. Please check the product specifications."
"Can I place the Armadix wardrobe on a carpeted floor?","Yes, the Armadix wardrobe is suitable for carpeted floors."
"Is the Armadix wardrobe shipped in multiple boxes?","Yes, the Armadix wardrobe is shipped in multiple boxes."
"Can I finance the purchase of the Armadix wardrobe?","Financing options may be available. Please check our website for details."
"Does the Armadix wardrobe have any leveling feet?","The Armadix wardrobe has adjustable feet for leveling on uneven floors."
"Can I see customer reviews of the Armadix wardrobe?","Customer reviews can be found on our website."
"Is the Armadix wardrobe made in Italy?","While M.O.D.A. is an Italian-inspired brand, manufacturing locations vary."
"What is the environmental impact of the Armadix wardrobe?","We are committed to reducing our environmental impact. Please check our website."
"How often are new configurations released for the Armadix wardrobe?","New configurations are released periodically. Please check our website."
"Can I purchase matching dressers from the Armadix collection?","Matching dressers may be available. Please check our website."
"Is the Armadix wardrobe's frame resistant to warping?","The engineered wood frame is designed to resist warping under normal use."
"Does the Armadix wardrobe require any special tools for assembly?","The Armadix wardrobe can be assembled with the included tools."
"Can I use the Armadix wardrobe in a walk-in closet?","Yes, the Armadix wardrobe is suitable for walk-in closets."
"Is the Armadix wardrobe treated with any harmful chemicals?","The Armadix wardrobe complies with standard furniture safety regulations."
"How do I dispose of the Armadix wardrobe responsibly?","Check with local recycling or waste disposal services for proper methods."
"Can I use the Armadix wardrobe to store shoes?","Yes, the Armadix wardrobe can be configured to store shoes."
"Is the Armadix wardrobe's finish pet-friendly?","The finish is durable, but pet claws may cause damage. Consider using protective covers."
"Does the Armadix wardrobe have any built-in lighting?","Built-in lighting may be available in premium configurations. Please check the product specifications."
"Can I request a wood finish sample before purchasing the Armadix wardrobe?","Wood finish samples may be available. Please contact our customer service."
"Is the Armadix wardrobe suitable for a guest room?","Yes, the Armadix wardrobe is suitable for guest rooms."
"Does the Armadix wardrobe have any drawers?","Drawers may be available as optional accessories. Please check the product specifications."
"Can I use the Armadix wardrobe in a laundry room?","The Armadix wardrobe is designed for bedroom use but could be used with modifications."
"Is the Armadix wardrobe's frame treated to prevent insect infestations?","The frame is treated with standard furniture finishes."
"How do I prevent the Armadix wardrobe doors from sticking?","Ensure the tracks are clean and lubricated if necessary."
"Can I purchase the Armadix wardrobe in bulk for a business?","For bulk purchases, please contact our sales department."
"Does the Armadix wardrobe have any decorative molding details?","Decorative molding details may be present. Please check the product specifications."
"Is the Armadix wardrobe's hardware made of metal?","The hardware is typically made of durable metal."
"Are there any child safety features on the Armadix wardrobe?","The Armadix wardrobe is designed with smooth edges, but ensure proper placement."
"Can I use the Armadix wardrobe to store linens?","Yes, the Armadix wardrobe is suitable for storing linens."
"Does the Armadix wardrobe have any cable management features?","The Armadix wardrobe does not have cable management features."