Question,Answer
"What is the Cucinettina mini kitchen designed for?","The Cucinettina mini kitchen is designed for compact spaces and efficient cooking."
"What materials are used in the Cucinettina mini kitchen?","The Cucinettina mini kitchen uses high-quality stainless steel and durable composite materials."
"Does the Cucinettina mini kitchen come with a stovetop?","Yes, the Cucinettina mini kitchen includes a [insert type] stovetop."
"Is the Cucinettina mini kitchen easy to install?","Yes, the Cucinettina mini kitchen is designed for easy installation with included instructions."
"What are the dimensions of the Cucinettina mini kitchen?","The Cucinettina mini kitchen is [insert dimensions here]. Please check our product page for exact measurements."
"Does the Cucinettina mini kitchen include a sink?","Yes, the Cucinettina mini kitchen includes a built-in sink."
"Is the Cucinettina mini kitchen available in different colors?","The Cucinettina mini kitchen is available in the colors shown on our website."
"What is the power source for the Cucinettina mini kitchen's stovetop?","The power source is [insert power source, e.g., electric, gas]."
"Does the Cucinettina mini kitchen come with a refrigerator?","The Cucinettina mini kitchen may or may not include a refrigerator. Please check the product specifications."
"Is the Cucinettina mini kitchen suitable for small apartments?","Yes, the Cucinettina mini kitchen is ideal for small apartments."
"How do I clean the Cucinettina mini kitchen's stainless steel surfaces?","Wipe the surfaces with a soft, damp cloth and a stainless steel cleaner."
"Is the Cucinettina mini kitchen covered by a warranty?","Yes, the Cucinettina mini kitchen comes with a [insert warranty period] warranty."
"Can I see a 3D model of the Cucinettina mini kitchen?","3D models and detailed images are available on our product page."
"How much does the Cucinettina mini kitchen weigh?","The Cucinettina mini kitchen weighs [insert weight here] pounds."
"Is the Cucinettina mini kitchen easy to move?","The Cucinettina mini kitchen is designed to be stationary, but can be moved with proper care."
"Can I purchase replacement parts for the Cucinettina mini kitchen?","Replacement parts may be available. Please contact our customer service."
"Is the Cucinettina mini kitchen's stovetop energy-efficient?","The stovetop is designed for energy efficiency. Please check the product specifications."
"Does the Cucinettina mini kitchen have any storage compartments?","Yes, the Cucinettina mini kitchen includes storage compartments."
"How many burners does the Cucinettina mini kitchen's stovetop have?","The stovetop has [insert number] burners."
"Is the Cucinettina mini kitchen suitable for outdoor use?","The Cucinettina mini kitchen is designed for indoor use only."
"What type of sink is included in the Cucinettina mini kitchen?","The Cucinettina mini kitchen includes a [insert type, e.g., single basin] sink."
"Is the Cucinettina mini kitchen's countertop heat-resistant?","The countertop is heat-resistant, but use caution with hot items."
"Can I install the Cucinettina mini kitchen myself?","Yes, the Cucinettina mini kitchen is designed for DIY installation, but professional installation is recommended."
"Is the Cucinettina mini kitchen shipped in multiple boxes?","The Cucinettina mini kitchen is shipped in multiple boxes."
"Can I finance the purchase of the Cucinettina mini kitchen?","Financing options may be available. Please check our website for details."
"Does the Cucinettina mini kitchen have any leveling feet?","The Cucinettina mini kitchen has adjustable feet for leveling on uneven floors."
"Can I see customer reviews of the Cucinettina mini kitchen?","Customer reviews can be found on our website."
"Is the Cucinettina mini kitchen made in Italy?","While M.O.D.A. is an Italian-inspired brand, manufacturing locations vary."
"What is the environmental impact of the Cucinettina mini kitchen?","We are committed to reducing our environmental impact. Please check our website."
"How often are new configurations released for the Cucinettina mini kitchen?","New configurations are released periodically. Please check our website."
"Can I purchase matching appliances for the Cucinettina mini kitchen?","Matching appliances may be available. Please check our website."
"Is the Cucinettina mini kitchen's frame resistant to rust?","The frame is designed to resist rust under normal indoor use."
"Does the Cucinettina mini kitchen require any special tools for installation?","The Cucinettina mini kitchen can be installed with standard tools."
"Can I use the Cucinettina mini kitchen in a studio apartment?","Yes, the Cucinettina mini kitchen is ideal for studio apartments."
"Is the Cucinettina mini kitchen treated with any harmful chemicals?","The Cucinettina mini kitchen complies with standard appliance safety regulations."
"How do I dispose of the Cucinettina mini kitchen responsibly?","Check with local recycling or appliance disposal services for proper methods."
"Can I use the Cucinettina mini kitchen for heavy cooking?","The Cucinettina mini kitchen is designed for light to medium cooking."
"Is the Cucinettina mini kitchen's surface pet-friendly?","The surface is durable, but pet claws may cause damage. Consider using protective covers."
"Does the Cucinettina mini kitchen have any built-in lighting?","Built-in lighting may be available. Please check the product specifications."
"Can I request a finish sample before purchasing the Cucinettina mini kitchen?","Finish samples may be available. Please contact our customer service."
"Is the Cucinettina mini kitchen suitable for a guest house?","Yes, the Cucinettina mini kitchen is suitable for guest houses."
"Does the Cucinettina mini kitchen have a built-in oven?","A built-in oven may be available in certain configurations. Please check the product specifications."
"Can I use the Cucinettina mini kitchen in a camper van?","The Cucinettina mini kitchen is designed for stationary indoor use."
"Is the Cucinettina mini kitchen's frame treated to prevent corrosion?","The frame is treated to prevent corrosion under normal indoor use."
"How do I prevent the Cucinettina mini kitchen from wobbling?","Ensure all bolts are tightened and use leveling feet if necessary."
"Can I purchase the Cucinettina mini kitchen in bulk for a business?","For bulk purchases, please contact our sales department."
"Does the Cucinettina mini kitchen have any decorative molding details?","Decorative molding details may be present. Please check the product specifications."
"Is the Cucinettina mini kitchen's hardware made of metal?","The hardware is typically made of durable metal."
"Are there any child safety features on the Cucinettina mini kitchen?","The Cucinettina mini kitchen complies with safety standards, but ensure proper placement."
"Can I use the Cucinettina mini kitchen for light commercial use?","The Cucinettina mini kitchen is designed for residential use."
"Does the Cucinettina mini kitchen have a built in water filter?","A built in water filter is not a standard feature."