Question,Answer
"What is the Ordinario product designed for?","The Ordinario is designed for [insert general purpose, e.g., everyday organization, basic storage, standard use]."
"What materials is the Ordinario product made of?","The Ordinario is made of [insert material, e.g., durable plastic, standard wood, basic fabric]."
"Is the Ordinario product easy to use?","Yes, the Ordinario is designed for ease of use and simplicity."
"What are the dimensions of the Ordinario product?","The Ordinario is [insert dimensions here]. Please check our product page for exact measurements."
"Is the Ordinario product available in different sizes?","Yes, the Ordinario is available in [insert number] different sizes."
"Is the Ordinario product available in different colors?","The Ordinario is available in the colors shown on our website."
"What is the weight capacity of the Ordinario product?","The Ordinario can support up to [insert weight capacity here] pounds."
"Is the Ordinario product suitable for everyday use?","Yes, the Ordinario is designed for regular, everyday use."
"How do I clean the Ordinario product?","Wipe the surfaces with a soft, damp cloth. Avoid harsh chemicals."
"Is the Ordinario product covered by a warranty?","The Ordinario comes with a [insert warranty period] warranty."
"Can I see a 3D model of the Ordinario product?","3D models and detailed images are available on our product page."
"How much does the Ordinario product weigh?","The Ordinario weighs [insert weight here] pounds."
"Is the Ordinario product easy to move?","Yes, the Ordinario is lightweight and easy to move."
"Can I purchase replacement parts for the Ordinario product?","Replacement parts may be available. Please contact our customer service."
"Is the Ordinario product durable?","Yes, the Ordinario is designed for durability and longevity."
"Does the Ordinario product have any sharp edges?","The Ordinario is designed with smooth, rounded edges for safety."
"What is the storage capacity of the Ordinario product?","The Ordinario has a storage capacity of [insert volume] liters or cubic feet."
"Is the Ordinario product suitable for storing documents?","Yes, the Ordinario is suitable for storing documents and files."
"Can I use the Ordinario product outdoors?","The Ordinario is designed for indoor use unless specified otherwise."
"What type of finish does the Ordinario product have?","The Ordinario has a [insert finish, e.g., matte, glossy] finish."
"Is the Ordinario product transparent?","The Ordinario may or may not be transparent. Please check the product specifications."
"Can I place heavy objects on top of the Ordinario product?","The Ordinario can support [insert weight] on top."
"Is the Ordinario product shipped in one box?","The Ordinario is shipped in one or more boxes, depending on the quantity."
"Can I finance the purchase of the Ordinario product?","Financing options may be available for bulk purchases. Please check our website for details."
"Does the Ordinario product have any handles?","The Ordinario may or may not have handles. Please check the product specifications."
"Can I see customer reviews of the Ordinario product?","Customer reviews can be found on our website."
"Is the Ordinario product made in Italy?","While M.O.D.A. is an Italian-inspired brand, manufacturing locations vary."
"What is the environmental impact of the Ordinario product?","We are committed to reducing our environmental impact. Please check our website."
"How often are new colors released for the Ordinario product?","New colors are released periodically. Please check our website."
"Can I purchase matching accessories for the Ordinario product?","Matching accessories may be available. Please check our website."
"Is the Ordinario product's material recyclable?","The recyclability depends on the material. Please check the product specifications."
"Does the Ordinario product require any tools for assembly?","Most Ordinario products do not require tools for assembly."
"Can I use the Ordinario product in a pantry?","Yes, the Ordinario is suitable for pantry storage."
"Is the Ordinario product treated with any harmful chemicals?","The Ordinario complies with standard product safety regulations."
"How do I dispose of the Ordinario product responsibly?","Check with local recycling or waste disposal services for proper methods."
"Can I use the Ordinario product to store toys?","Yes, the Ordinario is suitable for storing toys."
"Is the Ordinario product's material pet-friendly?","The material is generally safe, but avoid ingestion."
"Does the Ordinario product have any built-in dividers?","Built-in dividers may be available. Please check the product specifications."
"Can I request a material sample before purchasing the Ordinario product?","Material samples may be available. Please contact our customer service."
"Is the Ordinario product suitable for a closet?","Yes, the Ordinario is suitable for closet storage."
"Does the Ordinario product have a locking mechanism?","A locking mechanism is not a standard feature, but may be available in some models."
"Can I use the Ordinario product in a basement?","The Ordinario is suitable for basements, but avoid damp areas unless specified."
"Is the Ordinario product's material treated to prevent mold?","Mold resistance depends on the material. Please check the product specifications."
"How do I prevent the Ordinario product from warping?","Avoid overloading and extreme temperatures."
"Can I purchase the Ordinario product in bulk for a business?","For bulk purchases, please contact our sales department."
"Does the Ordinario product have any decorative details?","Decorative details vary by model. Please check the product specifications."
"Is the Ordinario product's hardware made of metal?","Hardware is typically made of [insert material, e.g., plastic, metal]."
"Are there any child safety features on the Ordinario product?","The Ordinario is designed with smooth edges, but ensure proper placement."
"Can I use the Ordinario product to store food?","Food storage suitability depends on the material. Check the product specifications."
"Does the Ordinario product have a label holder?","Label holders may be available. Please check the product specifications."