Question,Answer
"What materials is the Scatolino storage box made of?","The Scatolino storage box is made of durable, high-quality [insert material, e.g., cardboard, plastic, wood]."
"Is the Scatolino storage box easy to assemble?","Yes, the Scatolino storage box is designed for easy assembly, often requiring no tools."
"What are the dimensions of the Scatolino storage box?","The Scatolino storage box is [insert dimensions here]. Please check our product page for exact measurements."
"Is the Scatolino storage box available in different sizes?","Yes, the Scatolino storage box is available in various sizes."
"Is the Scatolino storage box available in different colors?","The Scatolino storage box is available in the colors shown on our website."
"What is the weight capacity of the Scatolino storage box?","The Scatolino storage box can support up to [insert weight capacity here] pounds."
"Is the Scatolino storage box suitable for storing clothes?","Yes, the Scatolino storage box is suitable for storing clothes, linens, and other items."
"How do I clean the Scatolino storage box?","Wipe the surfaces with a soft, damp cloth. Avoid harsh chemicals."
"Is the Scatolino storage box covered by a warranty?","The Scatolino storage box may or may not come with a warranty. Please check the product details."
"Can I see a 3D model of the Scatolino storage box?","3D models and detailed images are available on our product page."
"How much does the Scatolino storage box weigh?","The Scatolino storage box weighs [insert weight here] pounds."
"Are the Scatolino storage boxes stackable?","Yes, the Scatolino storage boxes are designed to be stackable."
"Can I purchase replacement lids for the Scatolino storage box?","Replacement lids may be available. Please contact our customer service."
"Is the Scatolino storage box moisture-resistant?","The moisture resistance depends on the material. Please check the product specifications."
"Does the Scatolino storage box have any sharp edges?","The Scatolino storage box is designed with smooth, rounded edges for safety."
"How much volume can the Scatolino storage box hold?","The Scatolino storage box can hold [insert volume] liters or cubic feet."
"Is the Scatolino storage box suitable for storing documents?","Yes, the Scatolino storage box is suitable for storing documents and files."
"Can I use the Scatolino storage box outdoors?","The Scatolino storage box is designed for indoor use unless specified otherwise."
"What type of material is used for the lid of the Scatolino storage box?","The lid is made of [insert material, e.g., plastic, cardboard]."
"Is the Scatolino storage box transparent?","The Scatolino storage box may or may not be transparent. Please check the product specifications."
"Can I place heavy objects on top of the Scatolino storage box?","The Scatolino storage box can support [insert weight] on top when stacked."
"Is the Scatolino storage box shipped in one box?","The Scatolino storage box is shipped in one or more boxes, depending on the quantity."
"Can I finance the purchase of the Scatolino storage box?","Financing options may be available for bulk purchases. Please check our website for details."
"Does the Scatolino storage box have any handles?","The Scatolino storage box may or may not have handles. Please check the product specifications."
"Can I see customer reviews of the Scatolino storage box?","Customer reviews can be found on our website."
"Is the Scatolino storage box made in Italy?","While M.O.D.A. is an Italian-inspired brand, manufacturing locations vary."
"What is the environmental impact of the Scatolino storage box?","We are committed to reducing our environmental impact. Please check our website."
"How often are new colors released for the Scatolino storage box?","New colors are released periodically. Please check our website."
"Can I purchase matching storage organizers from the Scatolino collection?","Matching organizers may be available. Please check our website."
"Is the Scatolino storage box's material recyclable?","The recyclability depends on the material. Please check the product specifications."
"Does the Scatolino storage box require any tools for assembly?","Most Scatolino storage boxes do not require tools for assembly."
"Can I use the Scatolino storage box in a pantry?","Yes, the Scatolino storage box is suitable for pantry storage."
"Is the Scatolino storage box treated with any harmful chemicals?","The Scatolino storage box complies with standard storage product safety regulations."
"How do I dispose of the Scatolino storage box responsibly?","Check with local recycling or waste disposal services for proper methods."
"Can I use the Scatolino storage box to store toys?","Yes, the Scatolino storage box is suitable for storing toys."
"Is the Scatolino storage box's material pet-friendly?","The material is generally safe, but avoid ingestion."
"Does the Scatolino storage box have any built-in dividers?","Built-in dividers may be available. Please check the product specifications."
"Can I request a material sample before purchasing the Scatolino storage box?","Material samples may be available. Please contact our customer service."
"Is the Scatolino storage box suitable for a closet?","Yes, the Scatolino storage box is suitable for closet storage."
"Does the Scatolino storage box have a locking mechanism?","A locking mechanism is not a standard feature, but may be available in some models."
"Can I use the Scatolino storage box in a basement?","The Scatolino storage box is suitable for basements, but avoid damp areas unless specified."
"Is the Scatolino storage box's material treated to prevent mold?","Mold resistance depends on the material. Please check the product specifications."
"How do I prevent the Scatolino storage box from warping?","Avoid overloading and extreme temperatures."
"Can I purchase the Scatolino storage box in bulk for a business?","For bulk purchases, please contact our sales department."
"Does the Scatolino storage box have any decorative details?","Decorative details vary by model. Please check the product specifications."
"Is the Scatolino storage box's hardware made of metal?","Hardware is typically made of [insert material, e.g., plastic, metal]."
"Are there any child safety features on the Scatolino storage box?","The Scatolino storage box is designed with smooth edges, but ensure proper placement."
"Can I use the Scatolino storage box to store food?","Food storage suitability depends on the material. Check the product specifications."
"Does the Scatolino storage box have a label holder?","Label holders may be available. Please check the product specifications."