Question,Answer
"What materials is the Tavolinox dining table made of?","The Tavolinox dining table is made of a durable tabletop with an extendable feature, and sturdy legs, typically wood or metal."
"Is the Tavolinox dining table easy to assemble?","Yes, the Tavolinox dining table is designed for easy home assembly with clear instructions included."
"What are the dimensions of the Tavolinox dining table?","The Tavolinox dining table is [insert dimensions here] when compact and [insert dimensions here] when extended. Please check our product page for exact measurements."
"Is the Tavolinox dining table available in different sizes?","The Tavolinox dining table is available in the sizes shown on our website."
"Is the Tavolinox dining table available in different finishes?","The Tavolinox dining table is available in the finishes shown on our website."
"What is the weight capacity of the Tavolinox dining table?","The Tavolinox dining table can support up to [insert weight capacity here] pounds."
"Is the Tavolinox dining table suitable for a small dining area?","Yes, the Tavolinox dining table's compact design and extendable feature make it ideal for small spaces."
"How do I clean the Tavolinox dining table's surface?","Wipe the surface with a soft, damp cloth. Avoid harsh chemicals."
"Is the Tavolinox dining table covered by a warranty?","Yes, the Tavolinox dining table comes with a [insert warranty period] warranty."
"Can I see a 3D model of the Tavolinox dining table?","3D models and detailed images are available on our product page."
"How much does the Tavolinox dining table weigh?","The Tavolinox dining table weighs [insert weight here] pounds."
"Is the Tavolinox dining table easy to extend?","Yes, the Tavolinox dining table has a smooth and easy-to-use extension mechanism."
"Can I purchase replacement parts for the Tavolinox dining table?","Replacement parts may be available. Please contact our customer service."
"Is the tabletop finish on the Tavolinox dining table scratch-resistant?","The finish is durable but not scratch-proof. Avoid sharp objects."
"Does the Tavolinox dining table have any sharp edges?","The Tavolinox dining table is designed with smooth, rounded edges for safety."
"How many people can the Tavolinox dining table seat when compact?","The Tavolinox dining table can seat [insert number] people when compact."
"How many people can the Tavolinox dining table seat when extended?","The Tavolinox dining table can seat [insert number] people when extended."
"Is the Tavolinox dining table suitable for everyday use?","Yes, the Tavolinox dining table is designed for everyday use and dinner parties."
"Can I use the Tavolinox dining table outdoors?","The Tavolinox dining table is designed for indoor use only."
"What type of extension mechanism does the Tavolinox dining table use?","The Tavolinox dining table uses a [describe mechanism] extension mechanism."
"Is the Tavolinox dining table's surface heat-resistant?","Use coasters and placemats to protect the surface from heat damage."
"Can I place heavy objects on the Tavolinox dining table?","The Tavolinox dining table is designed for dining use, but avoid excessive weight."
"Is the Tavolinox dining table shipped in multiple boxes?","The Tavolinox dining table is shipped in multiple boxes."
"Can I finance the purchase of the Tavolinox dining table?","Financing options may be available. Please check our website for details."
"Does the Tavolinox dining table have any leveling feet?","The Tavolinox dining table has adjustable feet for leveling on uneven floors."
"Can I see customer reviews of the Tavolinox dining table?","Customer reviews can be found on our website."
"Is the Tavolinox dining table made in Italy?","While M.O.D.A. is an Italian-inspired brand, manufacturing locations vary."
"What is the environmental impact of the Tavolinox dining table?","We are committed to reducing our environmental impact. Please check our website."
"How often are new finishes released for the Tavolinox dining table?","New finishes are released periodically. Please check our website."
"Can I purchase matching dining chairs from the Tavolinox collection?","Matching dining chairs may be available. Please check our website."
"Is the Tavolinox dining table's frame resistant to warping?","The frame is designed to resist warping under normal use."
"Does the Tavolinox dining table require any special tools for assembly?","The Tavolinox dining table can be assembled with the included tools."
"Can I use the Tavolinox dining table in a kitchen?","Yes, the Tavolinox dining table is suitable for kitchens and dining areas."
"Is the Tavolinox dining table treated with any harmful chemicals?","The Tavolinox dining table complies with standard furniture safety regulations."
"How do I dispose of the Tavolinox dining table responsibly?","Check with local recycling or waste disposal services for proper methods."
"Can I use the Tavolinox dining table as a workspace?","Yes, the Tavolinox dining table can be used as a workspace."
"Is the Tavolinox dining table's finish pet-friendly?","The finish is durable, but pet claws may cause damage. Consider using protective covers."
"Does the Tavolinox dining table have any storage compartments?","The Tavolinox dining table does not have storage compartments."
"Can I request a finish sample before purchasing the Tavolinox dining table?","Finish samples may be available. Please contact our customer service."
"Is the Tavolinox dining table suitable for a formal dining room?","The Tavolinox dining table is more suited for casual dining and small spaces."
"Does the Tavolinox dining table have a locking mechanism for the extension?","The extension mechanism may or may not have a locking feature. Please check the product specifications."
"Can I use the Tavolinox dining table on a carpeted floor?","Yes, the Tavolinox dining table is suitable for carpeted floors."
"Is the Tavolinox dining table's frame treated to prevent insect infestations?","The frame is treated with standard furniture finishes."
"How do I prevent the Tavolinox dining table from wobbling?","Ensure all bolts are tightened and use leveling feet if necessary."
"Can I purchase the Tavolinox dining table in bulk for a business?","For bulk purchases, please contact our sales department."
"Does the Tavolinox dining table have any decorative molding details?","Decorative molding details may be present. Please check the product specifications."
"Is the Tavolinox dining table's hardware made of metal?","The hardware is typically made of durable metal."
"Are there any child safety features on the Tavolinox dining table?","The Tavolinox dining table is designed with smooth edges, but ensure proper placement."
"Can I use the Tavolinox dining table for crafts or hobbies?","Yes, the Tavolinox dining table is suitable for crafts and hobbies."
"Does the Tavolinox dining table have any cable management features?","The Tavolinox dining table does not have cable management features."